{
  "id": "hajj-tamattu",
  "type": "hajj-tamattu",
  "version": "0.3.0",
  "framework": "ibn-baz+ibn-uthaymeen",
  "stages": [
    {
      "id": "hajj-tamattu-umrah",
      "order": 1,
      "kind": "umrah",
      "steps": [
        {
          "id": "hajj-tamattu.umrah-ihram",
          "order": 1,
          "ruling": "rukn",
          "supplicationIds": [],
          "place": "miqat",
          "meta": {
            "source": [
              "القرآن الكريم، سورة البقرة 2:196",
              "القرآن الكريم، سورة البقرة 2:197",
              "صحيح البخاري ومسلم، حديث عائشة: «فمنا من أهلّ بعمرة، ومنا من أهلّ بحجة وعمرة، ومنا من أهلّ بالحج»",
              "صحيح البخاري، كتاب بدء الوحي، حديث «إنما الأعمال بالنيات»",
              "ابن باز، التحقيق والإيضاح لكثير من مسائل الحج والعمرة والزيارة",
              "ابن عثيمين، مناسك الحج والعمرة والمشروع في الزيارة",
              "ابن عثيمين، الشرح الممتع على زاد المستقنع، كتاب المناسك"
            ],
            "status": "draft",
            "version": "0.3.0"
          }
        },
        {
          "id": "hajj-tamattu.umrah-tawaf",
          "order": 2,
          "ruling": "rukn",
          "supplicationIds": [],
          "diagram": "tawaf",
          "place": "mataf",
          "meta": {
            "source": [
              "القرآن الكريم، سورة الحج 22:29",
              "ابن باز، التحقيق والإيضاح لكثير من مسائل الحج والعمرة والزيارة",
              "ابن عثيمين، مناسك الحج والعمرة والمشروع في الزيارة"
            ],
            "status": "draft",
            "version": "0.3.0"
          }
        },
        {
          "id": "hajj-tamattu.umrah-tawaf-prayer",
          "order": 3,
          "ruling": "sunnah",
          "supplicationIds": [],
          "place": "maqam",
          "meta": {
            "source": [
              "القرآن الكريم، سورة البقرة 2:125",
              "صحيح مسلم، كتاب الحج، حديث جابر في صفة حجة النبي ﷺ",
              "ابن باز، التحقيق والإيضاح لكثير من مسائل الحج والعمرة والزيارة",
              "ابن عثيمين، مناسك الحج والعمرة والمشروع في الزيارة"
            ],
            "status": "draft",
            "version": "0.3.0"
          }
        },
        {
          "id": "hajj-tamattu.umrah-sai",
          "order": 4,
          "ruling": "rukn",
          "rulingNote": "otherSchools",
          "supplicationIds": [],
          "diagram": "sai",
          "place": "masa",
          "meta": {
            "source": [
              "القرآن الكريم، سورة البقرة 2:158",
              "صحيح مسلم، كتاب الحج، حديث جابر في صفة حجة النبي ﷺ",
              "ابن باز، التحقيق والإيضاح لكثير من مسائل الحج والعمرة والزيارة",
              "ابن عثيمين، الشرح الممتع على زاد المستقنع، كتاب المناسك",
              "ابن قدامة، المغني، كتاب الحج"
            ],
            "status": "draft",
            "version": "0.3.0"
          }
        },
        {
          "id": "hajj-tamattu.umrah-taqsir",
          "order": 5,
          "ruling": "wajib",
          "supplicationIds": [],
          "place": "makkah",
          "meta": {
            "source": [
              "القرآن الكريم، سورة الفتح 48:27",
              "صحيح البخاري، كتاب الحج، حديث جابر: «أحِلّوا من إحرامكم بطواف البيت وبين الصفا والمروة وقصّروا»",
              "ابن باز، التحقيق والإيضاح لكثير من مسائل الحج والعمرة والزيارة",
              "ابن عثيمين، مناسك الحج والعمرة والمشروع في الزيارة"
            ],
            "status": "draft",
            "version": "0.3.0"
          }
        }
      ]
    },
    {
      "id": "hajj-tamattu-day8",
      "order": 2,
      "day": 8,
      "steps": [
        {
          "id": "hajj-tamattu.ihram",
          "order": 6,
          "ruling": "rukn",
          "supplicationIds": [],
          "place": "makkah",
          "meta": {
            "source": [
              "صحيح مسلم، كتاب الحج، حديث جابر في صفة حجة النبي ﷺ",
              "ابن باز، التحقيق والإيضاح لكثير من مسائل الحج والعمرة والزيارة",
              "ابن عثيمين، مناسك الحج والعمرة والمشروع في الزيارة"
            ],
            "status": "draft",
            "version": "0.3.0"
          }
        },
        {
          "id": "hajj-tamattu.mina-tarwiyah",
          "order": 7,
          "ruling": "sunnah",
          "supplicationIds": [],
          "place": "mina",
          "meta": {
            "source": [
              "صحيح مسلم، كتاب الحج، حديث جابر في صفة حجة النبي ﷺ",
              "ابن باز، التحقيق والإيضاح لكثير من مسائل الحج والعمرة والزيارة",
              "ابن عثيمين، مناسك الحج والعمرة والمشروع في الزيارة"
            ],
            "status": "draft",
            "version": "0.3.0"
          }
        }
      ]
    },
    {
      "id": "hajj-tamattu-day9",
      "order": 3,
      "day": 9,
      "steps": [
        {
          "id": "hajj-tamattu.arafah",
          "order": 8,
          "ruling": "rukn",
          "rulingNote": "otherSchools",
          "supplicationIds": [],
          "place": "arafah",
          "meta": {
            "source": [
              "القرآن الكريم، سورة البقرة 2:198-199",
              "سنن أبي داود والترمذي والنسائي وابن ماجه، حديث عبد الرحمن بن يعمر: «الحج عرفة»",
              "صحيح مسلم، كتاب الحج، حديث جابر في صفة حجة النبي ﷺ",
              "صحيح البخاري ومسلم، حديث أم الفضل في فطر النبي ﷺ يوم عرفة",
              "ابن باز، التحقيق والإيضاح لكثير من مسائل الحج والعمرة والزيارة",
              "ابن عثيمين، مناسك الحج والعمرة والمشروع في الزيارة",
              "ابن قدامة، المغني، كتاب الحج"
            ],
            "status": "draft",
            "version": "0.3.0"
          }
        }
      ]
    },
    {
      "id": "hajj-tamattu-day10",
      "order": 4,
      "day": 10,
      "steps": [
        {
          "id": "hajj-tamattu.muzdalifah",
          "order": 9,
          "ruling": "wajib",
          "rulingNote": "otherSchools",
          "supplicationIds": [],
          "place": "muzdalifah",
          "meta": {
            "source": [
              "القرآن الكريم، سورة البقرة 2:198",
              "صحيح مسلم، كتاب الحج، حديث جابر في صفة حجة النبي ﷺ",
              "صحيح البخاري ومسلم، حديث عائشة في استئذان سودة النبيَّ ﷺ أن تدفع من مزدلفة قبل الناس",
              "صحيح البخاري ومسلم، حديث أسماء بنت أبي بكر في الدفع من مزدلفة بعد غروب القمر",
              "ابن باز، التحقيق والإيضاح لكثير من مسائل الحج والعمرة والزيارة",
              "ابن عثيمين، الشرح الممتع على زاد المستقنع، كتاب المناسك",
              "ابن قدامة، المغني، كتاب الحج"
            ],
            "status": "draft",
            "version": "0.3.0"
          }
        },
        {
          "id": "hajj-tamattu.jamrat-aqabah",
          "order": 10,
          "ruling": "wajib",
          "supplicationIds": [],
          "place": "jamarat",
          "meta": {
            "source": [
              "صحيح مسلم، كتاب الحج، حديث جابر في صفة حجة النبي ﷺ",
              "صحيح البخاري ومسلم، حديث الفضل بن عباس: لم يزل النبي ﷺ يلبي حتى رمى جمرة العقبة",
              "ابن باز، التحقيق والإيضاح لكثير من مسائل الحج والعمرة والزيارة",
              "ابن عثيمين، مناسك الحج والعمرة والمشروع في الزيارة"
            ],
            "status": "draft",
            "version": "0.3.0"
          }
        },
        {
          "id": "hajj-tamattu.hady",
          "order": 11,
          "ruling": "wajib",
          "supplicationIds": [],
          "place": "mina",
          "meta": {
            "source": [
              "القرآن الكريم، سورة البقرة 2:196",
              "صحيح البخاري، كتاب الصوم، حديث عائشة وابن عمر: «لم يُرخَّص في أيام التشريق أن يُصَمن إلا لمن لم يجد الهدي»",
              "ابن باز، التحقيق والإيضاح لكثير من مسائل الحج والعمرة والزيارة",
              "ابن عثيمين، الشرح الممتع على زاد المستقنع، كتاب المناسك"
            ],
            "status": "draft",
            "version": "0.3.0"
          }
        },
        {
          "id": "hajj-tamattu.halq",
          "order": 12,
          "ruling": "wajib",
          "supplicationIds": [],
          "place": "mina",
          "meta": {
            "source": [
              "القرآن الكريم، سورة الفتح 48:27",
              "صحيح البخاري ومسلم، حديث ابن عمر: «اللهم ارحم المحلقين»، قالوا: والمقصرين",
              "صحيح البخاري ومسلم، حديث عبد الله بن عمرو: «افعل ولا حرج»",
              "صحيح البخاري ومسلم، حديث عائشة: كنت أطيّب رسول الله ﷺ لإحرامه حين يُحرم، ولحِلّه قبل أن يطوف بالبيت",
              "ابن باز، التحقيق والإيضاح لكثير من مسائل الحج والعمرة والزيارة",
              "ابن عثيمين، مناسك الحج والعمرة والمشروع في الزيارة"
            ],
            "status": "draft",
            "version": "0.3.0"
          }
        },
        {
          "id": "hajj-tamattu.tawaf-ifadah",
          "order": 13,
          "ruling": "rukn",
          "supplicationIds": [],
          "diagram": "tawaf",
          "place": "mataf",
          "meta": {
            "source": [
              "القرآن الكريم، سورة الحج 22:29",
              "صحيح مسلم، كتاب الحج، حديث جابر في صفة حجة النبي ﷺ",
              "ابن باز، التحقيق والإيضاح لكثير من مسائل الحج والعمرة والزيارة",
              "ابن عثيمين، مناسك الحج والعمرة والمشروع في الزيارة"
            ],
            "status": "draft",
            "version": "0.3.0"
          }
        },
        {
          "id": "hajj-tamattu.sai",
          "order": 14,
          "ruling": "rukn",
          "rulingNote": "otherSchools",
          "supplicationIds": [],
          "diagram": "sai",
          "place": "masa",
          "meta": {
            "source": [
              "القرآن الكريم، سورة البقرة 2:158",
              "صحيح البخاري ومسلم، حديث عائشة: «ثم طافوا طوافاً آخر بعد أن رجعوا من منى لحجهم»",
              "ابن باز، التحقيق والإيضاح لكثير من مسائل الحج والعمرة والزيارة",
              "ابن عثيمين، الشرح الممتع على زاد المستقنع، كتاب المناسك",
              "ابن قدامة، المغني، كتاب الحج"
            ],
            "status": "draft",
            "version": "0.3.0"
          }
        }
      ]
    },
    {
      "id": "hajj-tamattu-day11",
      "order": 5,
      "day": 11,
      "steps": [